,ID,Title
1014,91582,Add Connector integration
1015,91579,Add wyoming integration with stt
1016,91571,Add service set_preset_mode_with_end_datetime in Netatmo integration
1017,91521,Use language util in stt/tts
1018,91511,Add entity name translations to Buienradar
1019,91455,Update readme file
1020,91425,Update pysiaalarm to 3.1.0
1021,91349,Add Contact Energy NZ integration
1022,91248,Add entity name translations to bmw_connected_drive
1023,91194,Add romy vacuum core integration
1024,91167,Request steam online friends from batches
1025,91156,Pass trigger_variables when rendering time_delta in template trigger
1026,91141,Fix iotawatt unique_id
1027,91000,Kodi binary sensor entities for screensaver and DPMS information
1028,90967,Add arming/disarming state to Concord232
1029,90921,Fix flaky test in vesync
1030,90917,Fix lingering timers in mailbox
1031,90875,Add new integration KAT Bulgaria
1032,90860,Add config flow to Plant
1033,90786,Add support for Supla lights
1034,90741,SharkIQ Hotfix - Handle current installations by using default REGION
1035,90723,Support DIMMER and RGBLIGHTING Supla channels
1036,90716,Set correct livisi climate HVAC state
1037,90707,Add entity name translations to AVM Fritz!SmartHome
1038,90583,Provide ViCare diagnostics tests
1039,90521,Add charging modes and profiles to bmw_connected_drive
1040,90513,Solvis remote support
1041,90509,Resolve gtfs tz issues and adding humidity to forecast of openweathermap
1042,90506,Add swiss_public_transport polling count
1043,90501,Add control4 room based media player
1044,90455,Add support for humidifiers to VeSync
1045,90454,Add more graceful handling of JSONDecode errors
1046,90449,Be able to specify port for Sonarr
1047,90371,Refactor API Call and API Parse in Proxmox VE
1048,90347,Multi-device support for vicare
1049,90336,Update API URL in Start.ca Integration
1050,90283,"Add ""volume_step"" parameter to media_player.volume_up/volume_down"
1051,90275,Fix Solax updating disabled sensors
1052,90254,Add encoding configuration setting to REST and Scape
1053,90170,Add host discovery to niko home control
1054,90153,"Add ""stream"" to default_config"
1055,90112,Add Tado presence sensor to Tado home entity
1056,90095,Add support for solvis heating via solvis remote sc2_val.xml
1057,90064,Add new service to OpenTherm Gateway integration
1058,90026,Handle missing switch information in ezviz data
1059,90006,Add Flexit bacnet integration
1060,90004,Add TTS to pipelines
1061,90001,Fix octoprint down every two minutes
1062,89984,"Add ""last"" condition for current power consumption"
1063,89934,Add media search
1064,89917,Add rest switch template resource
1065,89915,Improve Doods
1066,89800,Add service to update digital ocean DNS records
1067,89775,Workday updates for config flow and YAML import
1068,89730,Data Update coordinator for iZone
1069,89642,Use test parametrize in SFR tests
1070,89625,Reolink add URL option
1071,89588,Consistently capitalize Tibber sensor names
1072,89579,Better manage connection errors in iZone
1073,89567,Bump aiopulse to 0.4.4
1074,89548,Add Vattenfall InCharge integration
1075,89547,Add availability to SQL sensor
1076,89541,Add window open mode for fritz climate
1077,89504,Add iNELS integration
1078,89460,Fix issues with swisscom router integration
1079,89383,Fix missing debouncer cancel in update coordinator
1080,89348,Envisalink Config Flow Support
1081,89328,Klyqa new integration
1082,89314,Add majestic virtual integration for Intellifire
1083,89313,Add heatnglo virtual integration for Intellifire
1084,89312,Add heatilator virtual integration for Intellifire
1085,89304,Initial commit for official ooler version.
1086,89267,Increase logging level for Netatmo API connection issues
1087,89258,Send button events for Livisi devices
1088,89257,Add reauthentication support to Jellyfin
1089,89243,Fix zwave_js failing to download diagnostics
1090,89223,Add suggested_values to config flow scaffold
1091,89216,Add OTBR option flow
1092,89215,Add sensor language option to sma integration
1093,89204,Update flo config_flow
1094,89182,Fix integration not working anymore due to a change in the suez portal
1095,89181,Add ability to disable/snooze alert notifications
1096,89121,Obihai code cleanup
1097,89113,Allow device type WasherDryer for home_connect component
1098,88941,Implement humidifier support in VeSync
1099,88886,"Add support for Livisi PSSO, ISS and ISS2 switch devices"
1100,88871,Google Assistant SDK: allow credentials from json to allow personal results
1101,88865,Add forecast attribute to AirNow
1102,88812,Add Xiaomi Miio deerma.humidifier.jsq2w
1103,88795,Add real as ads sensor type
1104,88737,Add cloud support to IntelliFire Integration
1105,88709,Add Sleep Timer control to IntelliFire Integration
1106,88676,Add virtual integrations for intellifire compatible fireplaces
1107,88635,Catch CancelledError when setting up components
1108,88578,Use title case for Transmission status sensor (#88578
1109,88576,Add PAX BLE integration
1110,88575,Jinja templating improvements
1111,88540,Intellidrive reisinger
1112,88530,Google Assistant SDK: allow users to have a separate custom integration for HTML parsing
1113,88489,Add clarifying comment about unit of elevation
1114,88422,Add session energy sensor and fix key of energy_wh for tesla_wall_connector
1115,88399,ONVIF device triggers and homeassistant event
1116,88318,Remove smartthings cooling setpoint requirement for thermostats
1117,88276,Fix 500 error when getting calendar events
1118,88072,Fix MQTT double topic subscribtion
1119,88040,Whirlpool disable detergent level by default
1120,88015,Update locationsharinglib version to 4.1.8
1121,87968,Add sensors supported by Awair Element local api
1122,87930,Skip refresh of Speedtest sensors if disabled in system options
1123,87927,"Create a ""schedule"" entity"
1124,87915,Add ConfigFlow for SPC
1125,87910,"Provide light actions [flash, brightness_increase, brightness_decrease] also as a service"
1126,87863,Update and enhance trend sensor
1127,87856,Add climate Tuya Power command instead of switch - Airton climate
1128,87774,Add V2C integration
1129,87750,Add basic support for IPv6 on Route53 Component
1130,87748,Add Southern company integration
1131,87717,Add more bitwise operations as template helpers
1132,87672,Add Inches of Water Column as a unit of pressure
1133,87666,Add preset temperatures to generic thermostat attributes
1134,87665,Extend energyzero sensors to use data of tomorrow
1135,87567,Fix entur_public_transport API Ratelimit
1136,87544,Bypass validation empty code for lock
1137,87508,Add water heater manual state
1138,87486,Add bypass_zone service for totalconnect
1139,87393,Introduce entity descriptions for OpenTherm entities
1140,87370,Add more sensors to the RYM Pro integration
1141,87366,Add color support to matter lights
1142,87249,added device_class for API_VOC
1143,87222,Allow workday binary_sensor to be configured without a country.
1144,87139,Add Water device class to Overkiz
1145,87107,Downloader with additional timeout attribute
1146,87093,Add Swiss public transport departure time state attribute
1147,87067,Bump pydaikin 2.9.0
1148,87015,Fix Matter bridge devices
1149,86930,Add Imazu Wall Pad
1150,86923,Add SWS12500 Weather Station integration
1151,86841,Ignore empty payloads from DSMR Reader
1152,86840,Emoncms cleanup
1153,86834,Assign unique ID to iotawatt outputs
1154,86756,Add config flow to Torque
1155,86717,Add reauthentication support for LIVISI integration
1156,86639,Deprecate min_max integration
1157,86636,Add Support for Luxtronik2 heatpumps
1158,86556,Only update deCONZ config from HASSIO addon if integration is not running
1159,86521,Manage LL-HLS fragmenting when audio is present
1160,86395,Bump airthings-ble to 0.5.5
1161,86386,Add support for externally connected utility devices in HomeWizard
1162,86281,Add config.update_entity and config.remove_entity services
1163,86265,Fix SNMP TypeError
1164,86241,Add Tuya Dehumidifier Product Category cs
1165,86238,Allow number entities to alexa
1166,86225,Fix exception in home_connect.light
1167,86156,Add config flow to DuckDNS
1168,86120,Add config flow to Hikvision
1169,86093,Add config flow to Melissa
1170,86086,Add state attributes for lock component
1171,86084,Add Asus Router integration
1172,86076,Cast enum sensor value to str to compare options
1173,86067,Fixed pl translation hysteresis in threshold
1174,86060,"Add ""ip_version"" configuration option for Wake on lan"
1175,85978,Create tests from ads covers
1176,85977,Add iNELS integration
1177,85964,Add ppb to allowed VOC values
1178,85947,Adds 4 test cases
1179,85939,"modbus sensor: support float, add min_value; slave: support unique_idâ€¦"
1180,85896,Add config flow to Systemmonitor
1181,85893,Add Sunsynk Integration
1182,85782,Bump gassist-text to 0.0.10
1183,85647,Add more Coffee Maker Programs to Home Connect
1184,85601,Add extra sensors by adding support to the extended ESIOS API with API Token
1185,85570,Reolink check for admin
1186,85518,Bump  prayer-times-calculator to 0.0.8
1187,85389,Feature/shopping list entity
1188,85349,Add mikrotik routerboard and chr
1189,85327,Add support for extractor hood tuya device (device type yyj)
1190,85314,Add config flow to Hydrawise
1191,85196,Update mqtt const
1192,85189,Add radiation units
1193,85174,Added get_location
1194,85146,Renovate IQVIA config flow tests
1195,85140,Renovate WattTime config flow tests
1196,85125,Add event(s) for failed login and IP ban
1197,85100,Add option to use ssl in Transmission
1198,85082,Add humidity sensor to TEMPer USB devices
1199,85029,Add new 2N Telekomunikace integration
1200,84998,Add support for enocean shutter contacts (EEP D5-00-01)
1201,84951,Homely
1202,84876,Zeversolar integration
1203,84869,Initial setup for Sunbeam Dual Zone Heated Bedding
1204,84851,Add Whirlpool washer and dryer to Whirlpool integration
1205,84790,Add Dobson Units as a valid concentration unit for atmospheric ozone
1206,84757,Add yolink flexfob remote support
1207,84673,Add support for SwitchBot Lock
1208,84610,Add Config Flow to the Nextcloud Integration
1209,84602,"Add Trydan integration, first try."
1210,84573,Add custom ssl_context to aiohttp helper
1211,84519,Fix HAA homekit integration
1212,84496,Add Âµm to Length units
1213,84482,Fix Scrape config flow to allow removal of values once set
1214,84443,Seitron integration
1215,84282,Fix alarm_control_panel representing triggers and conditions based on supported features
1216,84272,Fix missing keys handling in hive device data
1217,84227,Add a calendar entity to Sonarr
1218,84212,Update dsmr_reader sensor definitions
1219,84204,Create ability to add PurpleAir sensor by ID/index
1220,84168,Update ConnectSense Energy Sensor State Class
1221,84163,Add GA workflow to test setup script
1222,84158,Fix Cocoa dependency conflict in venv setup
1223,84094,Fix tuya camera stream
1224,84025,Add support for VeSync Humidifiers
1225,84005,"Add Tuya Irrigation, Category: GGQ"
1226,83965,Add config flow to Generic Hygrostat
1227,83938,Refactor withings descriptions to use device classes
1228,83561,New Integration: Honeygain
1229,83484,Add config flow to Roth Touchline
1230,83459,Handle Twinkly devices without movies
1231,83456,Add @nyroDev to overkiz codeowner
1232,83430,Create a new Update entity for Overkiz
1233,83278,Bump velbus-aio to 2022.12.0
1234,83252,Add lastfm scrobble service
1235,83247,Add bouncie integration
1236,83204,Add Twinkly diagnostics
1237,83173,Improve type hints in nws
1238,83117,Reload HomeWizard when new firmware is detected
1239,83079,Add integration with OVH's DynHost
1240,83069,Add Rointe integration
1241,83056,Bump the modbus integration library to V3.0.2
1242,83035,Add HTTPS support for Fully Kiosk
1243,83023,Add playlist to effect list
1244,83018,Fix threshold binary sensor unknown returned value for upper and lower limits
1245,83016,Use new Kelvin mode of color_temp selector
1246,82959,Add TED (The Energy Detective) integration
1247,82958,Fully Kiosk - HTTPS support
1248,82945,Add extra fields to citybikes provider
1249,82910,Adds template helpers for generating URLs
1250,82877,Fix updating brightness from state when color is supported
1251,82850,Initial Edilkamin stove integration
1252,82782,Move Min/Max yaml to integration yaml key
1253,82771,Change MIN_TIME_BETWEEN_UPDATES to 2 seconds for apcupsd.
1254,82753,Improve the devcontainer
1255,82697,Add more Tuya Thermostat state entities
1256,82659,Add livisi window sensor
1257,82622,Add YoLink MultiOutlet support
1258,82539,Add support for market holidays to workday sensor
1259,82533,Add extra attibutes to Tuya climate entity
1260,82499,Add support for air purifier devices in HomeKit
1261,82486,Add Enocean contact sensor
1262,82468,Add unit of measurement to Tuya air measurements
1263,82419,Make Kegtron sensor keys tuples
1264,82391,Add integration for Kostal Piko solar inverters
1265,82368,Align manual_mqtt alarm control panel with manual
1266,82332,edl21: make scan interval configurable
1267,82285,Add signal_messenger_jsonrpc notification
1268,82280,Add unique_id to envisalink binary_sensor
1269,82221,Update Tibber setup_entry flow
1270,82132,Verify comfoconnect connection with bridge
1271,81972,New Heatzy component
1272,81970,Add yolink Dimmer support
1273,81957,Growatt - Temporary workaround for #81951
1274,81832,Support hvac mode HEAT_COOL in Homekit Controller
1275,81807,Log better error when sending non-critical message to screensaver'd LaMetric
1276,81795,Improve (test) requirements generation
1277,81755,Add HTTP API to get camera stream source
1278,81724,Add Combined Energy integration
1279,81701,Add fan support for lyric
1280,81662,Add unique_id to SNMP switch platform
1281,81625,Update lutron_caseta buttons to use keypad data
1282,81599,Allow iBeacon without name
1283,81381,Fix Tuya climate entities requiring both Celsius and Fahrenheit to show climate data
1284,81377,Add unique_id to Ping sensor
1285,81371,Add power commands to SystemBridge
1286,81325,Add sleep and wakeup to foscam as switch
1287,81224,Refactor Command line switch to inherit TemplateEntity
1288,81223,TP-Link Omada integration
1289,81167,Add Epic Games Store integration
1290,81067,Bump pyswitchbee to 1.6.1
1291,80776,Konnected test coverage
1292,80774,Add nextcloud config flow
1293,80772,Verisure
1294,80744,Add action callbacks to simplepush
1295,80719,Add core mediaplayer grouping to bluesound
1296,80717,Add support for Tuya eco climate
1297,80617,Use PRECIPITATION units in integrations
1298,80600,Allow integrations to specify unit_of_measurement used for the sensor state
1299,80553,Google-Assistant: Fix current temp is none
1300,80485,Add days_remaining attribute
1301,80477,Remove troublesome out of date translated strings for life360
1302,80429,Expose annotation option for camera snapshot
1303,80424,Add more PrusaLink sensors
1304,80373,Windows IIS Reverse Proxy IPv6 Support
1305,80358,Addition of a schedule configure service
1306,80346,Landis+Gyr T550 support by adding MWh-reading
1307,80330,Add Sonoff to brands
1308,80329,"Add ""verisure"", ""zha"", and ""zwave"" to Yale brand"
1309,80326,Add formula_one integration
1310,80316,Bump pyTibber to 0.25.4
1311,80293,Add Sonos brand
1312,80283,Add OralB integration
1313,80135,Replace atome by keyatome 7.4.0
1314,80060,Add Adguard Home list_type to add/remove url services
1315,80059,Add parameters for minimum brightness on light integration
1316,80045,Add Vicare switch to allow disabling the onetimecharge
1317,80007,Imap email content decode base64 encoded body
1318,79973,Add an RSSI sensor to the LIFX integration
1319,79944,Add GPS support to dwd_weather_warnings
1320,79920,"Allow specifying custom IP ""resolver"" for Route53."
1321,79896,Home Connect: Operation state translations
1322,79879,Bayesian - support unique_id:
1323,79877,Add unique_id to Broadlink IR switch
1324,79853,Note SoyeaLink support in Huawei LTE comments
1325,79817,Add IKEA to brands
1326,79792,Use a unique cache folder per Velbus config entry
1327,79632,"Bump PySwitchbot, Add contact sensor button count"
1328,79580,Add support for UK units in VolumeConverter
1329,79572,"Fitbit: Create a device for the Fitbit user, to group Fitbit sensors and generate nicer names and entity IDs"
1330,79564,Handle numbers just like sensors in prometheus
1331,79495,Convert network mode from sensor to select for huawei_lte
1332,79488,Device condition camera
1333,79455,Add support for the Flame and Morph effects for Tile and Candle
1334,79398,Add Sum helper
1335,79329,Add volvo on call device_info to group entities in one device per vehicle
1336,79324,Implement sync time button for moehlenhoff_alpha2
1337,79233,Update huisbaasje-client 0.1.0 to energyflip-client 0.2.0
1338,79187,Add missing entity name
1339,79149,Add Edit Sheet service to Google Sheets
1340,79108,Enocean window door contact
1341,79055,Tuya smart water timer
1342,78986,FIX Incorrect TAG
1343,78982,"Extend Tuya Support: Doorbells, Air Purifiers, Light"
1344,78899,"Increase interval to 30min, add interval to OptionsFlow"
1345,78839,Add HaFAS integration
1346,78778,Add config options support in volvooncall
1347,78740,Change attribute bluesound_group to be entity_ids
1348,78725,Fix issue that HomeKit_Controller/HeaterCooler won't turn on
1349,78686,Light reload service
1350,78665,Add Overkiz AtlanticPassAPCDHW
1351,78659,Add Overkiz AtlanticPassAPCHeatingAndCoolingZone
1352,78657,Add hourly forecast to SMHI
1353,78647,Add IMAP SSL configuration option
1354,78633,Add brightness functions to services.yaml
1355,78614,Add extra_rooms option to mqtt_rooms
1356,78601,Klyqa smart devices integration
1357,78594,Allow srp_energy to have multiple configs
1358,78579,Add new MAC address mask to Broadlink for DHCP discovery
1359,78561,Fix Flume devices with missing location
1360,78549,Change blinkstick requirement
1361,78528,Add EnOcean binary_sensor STM 250 magnet contact support
1362,78423,Disentangle state and config in water heater
1363,78370,Caldav ssl mutual auth
1364,78332,Retry on unavailable IPMA api
1365,78326,Add horizon to forecast.solar integration
1366,78231,Update daikin sensors
1367,78192,Fix media_player Toggle when in idle
1368,78065,Add set chime duration service to unifiprotect
1369,77954,Move twilio to config flow completely
1370,77794,Fix shopping_list service calls not notifying event bus
1371,77765,Add filesystem free sensor and fix unit conversion for System Bridge
1372,77737,Add climate group
1373,77736,Workaround for Tuya BHT-002 thermostat family
1374,77622,Update requirements_all.txt
1375,77527,Configurable delay when setting up Risco local
1376,77518,Reuse the MQTT client not disrupting manual items during reload
1377,77381,Add support for Hatch Rest noise machine and light
1378,77374,Add configurable update interval to OpenWeather
1379,77316,Fix typo error in MQTT english translation
1380,77315,Add alarmed binary sensor to Risco integration
1381,77258,Improve automations and scripts error logging
1382,77249,Add inels integration
1383,77217,Update forecast.solar sensor values exactly when reported API values change
1384,77188,MPRIS Linux HTPC/desktop/laptop media player remote control
1385,77146,REST binary sensor enable attributes and XML data
1386,77112,Add config/sensor for Tuya GYD cat-Motion Light
1387,77103,Bump Tank Utility Version
1388,77079,Add Stream & Thumb feature to Telegram send_video
1389,77064,Add Xiaomi Airpurifier 4 Lite support
1390,77055,Add new integration mhtzn
1391,77048,Add lastCommand attribute
1392,77044,ZHA backup/restore config flow
1393,76925,Parent grid option for individual device and per device cost calculation
1394,76890,Add repair to suggest using Awair local integration
1395,76761,Add test for Jellyfin media source
1396,76756,Add Tami4 Integration
1397,76749,Update tts.py to support Dutch (Belgian accent)
1398,76706,Expose extra PJLink data as state attributes
1399,76696,Fix polling interval bug in Overkiz integration
1400,76597,Add sqlalchemy and fnvhash to requirements
1401,76503,Fix Tuya dimmers not dimming
1402,76463,Support enocean teach in
1403,76332,Bump pyipma to 3.0.2
1404,76308,default_config: only load bluetooth on bleak supported platforms
1405,76304,Add aqara binary sensor feature
1406,76295,"Remove deprecated airQuality, add binary_sensor platform"
1407,76289,Add config flow to local_file
1408,76259,Bump schiene to 0.24
1409,76246,Add HomeWizard repair item when API is disabled
1410,76190,Add Aqara
1411,76170,Add issue to repairs for removed Skybell YAML configuration
1412,76145,Add config flow to PJLink
1413,76140,Add repair issue for deprecated Guardian services
1414,76123,Ble sensor & Bump AIOAladdinConnect to 0.1.41
1415,76088,Add optional timeout config to pjlink
1416,76027,Add update entity to mikrotik
1417,75950,Fix capitalization in mitemp_bt strings
1418,75944,Add typings to OVO Energy integration
1419,75905,"Bump plugwise to v0.21.2, add related new features"
1420,75867,Fix HaveIBeenPwned integration
1421,75766,Provide 'entities' variable for service call templates
1422,75681,Add lawn_mower entity
1423,75680,Allow fints config as fallback for account type
1424,75620,Add ability to define source interface to wake_on_lan
1425,75585,Add Sutro integration
1426,75548,improvements to USCIS sensor
1427,75458,Modify IQVIA to store a single dataclass in hass.data
1428,75420,IQVIA's Prediction Sensors don't have state_class
1429,75412,Enable Wemo option for subscriptions across subnets
1430,75356,Add support for EnOcean cover (roller shutters based on EEP D2-05-00)
1431,75345,Update Dockerfile.dev to Python 3.10
1432,75282,Modify SSL @SECLEVEL=1 for Bbox
1433,75251,Add Status and Configuration Entities for Tuya Smart Locks
1434,75247,Add config flow to Proxmox VE
1435,75246,Add presets to Advantage Air climate entities
1436,75230,Frontend Bump 20220707.1
1437,75150,Add core integration mhtzn
1438,75130,Add helper to get ConfigEntry from a ServiceCall
1439,75128,Add tuya pir motion sensitivity select
1440,75127,Migrate AccuWeather to new entity naming style
1441,75115,Replace a custom service with Number platform in Advantage Air
1442,75083,Change comed_hourly_pricing sensor unit
1443,75068,Upgrade volvooncall to v0.10.1 and support new usa_units configuration option
1444,74893,Add Pylontech integration
1445,74757,Bump atomicwrites dependency to fix #74751
1446,74699,Add Unique IDs to Satel Integra
1447,74690,Add update coordinator for google calendar
1448,74641,Add missing strings for here_travel_time
1449,74508,Fix invalid enocean unique_id
1450,74486,Allow to turn on Python debugger in the container
1451,74478,"Update iAqualink to handle the new ""absent"" response from API"
1452,74438,Add device info and long term statistics to transmission
1453,74427,Remove lutron_caseta from mypy ignore list
1454,74361,Use less strict certificate checking for ComEd
1455,74331,ci: Add GitHub token permissions for workflows
1456,74082,Add additional attributes to tank_utility sensors
1457,74045,Add AirQualityEntity to pylint checks
1458,74025,Add additional attributes to UniFi devices
1459,73956,Add config flow to smtp
1460,73940,Update VS Code devcontainer configuration
1461,73911,Implemented RestoreEntity for Dynalite
1462,73877,Add Proxmox VE current memory usage sensor
1463,73865,Round electric current value of Fritz!DECT smart plugs
1464,73782,Add state class to UPnP sensors
1465,73693,Account for DD in time_period_str
1466,73672,Specify device_class and state_class on OpenEVSE sensors
1467,73251,Add retry package to deal with timeouts
1468,73228,Explicitly generate an _external_ webhook URL for Withings integration
1469,73187,Support SSL and toggling SSL certificate verification in ubus device_tracker
1470,73100,Update Waze Travel Time to 0.15
1471,73082,Add config flow to Caldav
1472,73043,Netatmo refactor to use pyatmo 7.0.1
1473,72987,Update meraki for api version 2.1
1474,72982,New integration: Poolstation
1475,72730,Smart radio browser
1476,72715,Fix SmartThings issue with unique_id
1477,72674,Add Huum integration
1478,72608,Defer google calendar integration reload to a task to avoid races of reload during setup
1479,72541,Add cloud as dependency for application_credentials
1480,72450,Update Plugwise climate
1481,72308,Set here_travel_time quality scale to gold
1482,72294,Fix telegram bot from_first/last in callback_query event
1483,72202,Add partial support for Tuya Power Clamp
1484,72198,Adjust device_automation type hints in kodi
1485,72160,Fix zone trigger (zone->zone)
1486,72145,Add support for vesync multicolor light bulb
1487,72045,bugfix for circular imports issue
1488,71978,Correct unit of measurement for Synology DSM volume sensors
1489,71922,Intent script
1490,71920,Amazon polly
1491,71867,Use recorder db_url to determine default database for sql
1492,71764,Add remaining tests for Sensibo
1493,71612,"Warn user if ""model"" key is missing from Shelly firmware"
1494,71534,Add Aqara integration
1495,71526,Add Sungrow solar inverter integration
1496,71523,New integration for IDS Hyyp Alarms
1497,71485,Save jellyfin client id on configuration
1498,71264,Add currently playing track's context to Spotify's state attributes
1499,71257,Rename remote_rpi_gpio pins config item and add port config item
1500,71117,Fix warning to upgrade pip in bootstrap script
1501,70982,Translation update
1502,70980,Add QNAP QSW Button platform
1503,70444,Add slimproto integration (Squeezebox players)
1504,70295,Add binary sensors to generic camera
1505,70261,Update 17track integration to use v1 API
1506,70191,Fix too short timeout on skybell binary sensors
1507,70150,Do not update successful set up Synology DSM config entry via SSDP
1508,69806,BMW Connected Drive: Notify listeners after button execution
1509,69804,Provide NINA warnings also in one sensor
1510,69710,Provide statistics device_class based on source entity and characteristic
1511,69555,Reisingerbridge
1512,69378,Generic fix stream thumbnail
